{
  "project": "TAG TRACE",
  "repository": "RBeno/tag-trace",
  "documentationVersion": "1.67.0",
  "currentPhase": "F5",
  "phaseName": "Laboratorio de incidencias",
  "status": "in_progress",
  "baseline": "approved",
  "lastUpdated": "2026-10-17",
  "implementationStarted": true,
  "legacyRepository": "RBeno/tag-trace-agv",
  "nextTransition": {
    "targetPhase": "F6",
    "requiredApproval": "CONTINÚA FASE 6",
    "gate": "G5"
  },
  "dataPolicy": {
    "processing": "local-only",
    "githubAllowed": [
      "source-code",
      "documentation",
      "synthetic-fixtures"
    ],
    "githubForbidden": [
      "real-csv",
      "real-projects",
      "real-reports",
      "real-graphs",
      "real-configurations"
    ]
  }
}
